{
  "format": "atlas/1",
  "meta": { "title": "Module dependencies", "direction": "right", "selected": "api" },
  "nodes": [
    { "id": "app", "title": "app", "subtitle": "entry point" },
    { "id": "router", "title": "router", "subtitle": "URL → view" },
    { "id": "views", "title": "views", "subtitle": "pages" },
    { "id": "store", "title": "store", "subtitle": "state" },
    { "id": "api", "title": "api", "subtitle": "HTTP client" },
    { "id": "auth", "title": "auth", "subtitle": "tokens" },
    { "id": "cache", "title": "cache", "subtitle": "memory + IndexedDB" },
    { "id": "i18n", "title": "i18n", "subtitle": "translations" },
    { "id": "ui", "title": "ui", "subtitle": "components" },
    { "id": "theme", "title": "theme", "subtitle": "tokens" },
    { "id": "fetch", "title": "fetch", "subtitle": "platform" },
    { "id": "storage", "title": "storage", "subtitle": "platform" }
  ],
  "edges": [
    { "from": "app", "to": "router", "label": "mounts" },
    { "from": "app", "to": "store", "label": "creates" },
    { "from": "app", "to": "i18n", "label": "loads" },
    { "from": "router", "to": "views", "label": "renders" },
    { "from": "views", "to": "ui", "label": "uses" },
    { "from": "views", "to": "store", "label": "reads" },
    { "from": "store", "to": "api", "label": "syncs through" },
    { "from": "api", "to": "auth", "label": "signs with" },
    { "from": "api", "to": "cache", "label": "caches in" },
    { "from": "api", "to": "fetch", "label": "calls" },
    { "from": "auth", "to": "storage", "label": "keeps token in" },
    { "from": "cache", "to": "storage", "label": "persists to" },
    { "from": "ui", "to": "theme", "label": "styled by" },
    { "from": "ui", "to": "i18n", "label": "translated by" }
  ]
}
