{"meta":{"ordered":true},"lanes":[{"id":"L"},{"id":"M"},{"id":"N"}],"groups":[{"id":"G"}],"nodes":[{"id":"n0","lane":"N","group":"G"},{"id":"n1","lane":"L","group":"G"},{"id":"n2","lane":"M"},{"id":"n3","lane":"M"},{"id":"n4","lane":"N","pinned":true},{"id":"n5","lane":"M","group":"G"},{"id":"n6","lane":"M","group":"G","pinned":true},{"id":"n7","lane":"L"},{"id":"n8","lane":"L","group":"G"},{"id":"n9","lane":"L"},{"id":"n10","lane":"N"}],"edges":[{"from":"n2","to":"n3"},{"from":"n10","to":"n0"},{"from":"n3","to":"n4"},{"from":"n3","to":"n6"},{"from":"n1","to":"n9"},{"from":"n7","to":"n4"},{"from":"n3","to":"n8"},{"from":"n5","to":"n3"},{"from":"n9","to":"n7"},{"from":"n6","to":"n3"},{"from":"n4","to":"n0"},{"from":"n0","to":"n1"},{"from":"n9","to":"n7"},{"from":"n9","to":"n5"},{"from":"n6","to":"n1"},{"from":"n1","to":"n4"}]}
